{
  "schema_version": "2",
  "graders": {
    "package_links": "2.0.0",
    "manifest_accounting": "2.0.0",
    "build_traceability": "2.0.0",
    "revision_consistency": "2.0.0",
    "routing_outcomes": "2.0.0",
    "adoption_consistency": "2.0.0",
    "build_traceability_v2": "2.0.0",
    "revision_consistency_v2": "2.0.0",
    "routing_outcomes_v2": "2.0.0"
  },
  "profiles": {
    "legacy-import-v1": {
      "version": "1",
      "graders": [
        "package_links",
        "manifest_accounting"
      ]
    },
    "import-v2": {
      "version": "2",
      "graders": [
        "package_links",
        "manifest_accounting",
        "build_traceability"
      ]
    },
    "spec-v1": {
      "version": "1",
      "graders": [
        "package_links",
        "build_traceability"
      ]
    },
    "revision-import-v2": {
      "version": "2",
      "graders": [
        "package_links",
        "manifest_accounting",
        "build_traceability",
        "revision_consistency"
      ]
    },
    "revision-spec-v1": {
      "version": "1",
      "graders": [
        "package_links",
        "build_traceability",
        "revision_consistency"
      ]
    },
    "builder-v2": {
      "version": "2",
      "graders": [
        "package_links",
        "manifest_accounting",
        "build_traceability",
        "revision_consistency",
        "routing_outcomes"
      ]
    },
    "adoption-v1": {
      "version": "1",
      "graders": [
        "adoption_consistency"
      ]
    },
    "revision-spec-v2": {
      "version": "2",
      "graders": [
        "package_links",
        "build_traceability_v2",
        "revision_consistency_v2"
      ]
    },
    "routing-adoption-v1": {
      "version": "1",
      "graders": [
        "routing_outcomes_v2"
      ]
    }
  },
  "artifacts": {
    "SKILL.md": "9e572b2ddfb67279f9cf5006cc5bba4cd73edb66728ff769fa9b0ae6fd981fdf",
    "assets/enforcement-register-template.md": "2c1ee850a8fa96c3f8b33a27c504939ef4951283b09e8a1425c82f533bcb5e7c",
    "assets/openai-yaml-guidance.md": "7039d465b05342cbacf861f08d20192ab1eeee112bc5d8ff0fb66234756887a9",
    "assets/origin-spec-template.md": "c72e87c6e6fb33781d446f5dcf1ae0f672207c15ea4b4a52ec7567536f361902",
    "assets/revision-spec-template.md": "89acab27def48848eefa77634f1aec733edd8a87be47ec6d8a8a6fdacf3ab62e",
    "assets/rules-snapshot.json": "53796ef387398a4120d3d055d21c0056fe5ea45c6b414188f13bb6916ed0ac76",
    "assets/validation-report-template.md": "bea34d47011668976e440b47eddbd1c33e415d5ea5d264fc78d2b39ab8f3a5ab",
    "evals/README.md": "9f4358c910ebbf719db3d1fce7dd72621cea82122850c81449258c709cab8917",
    "evals/adoption-evidence.schema.json": "35c98801c9b09b4679720ac07048c334c907fcebcd77cc66213fa72176587d5f",
    "evals/build-artifacts.schema.json": "d207c4c14eef018d296286caf98ca2630cc85d0fd182b2c651ff8251f953f2be",
    "evals/builder-cases.jsonl": "de1fc28e754c2f28b5fb838258ce66eb6f258e93ace87a2db6a2685464bb277c",
    "evals/cases.jsonl": "554b9d00519e1fbc297e298223c01edd1fe8f91a98e92a0ea8cdcf92d0a1c96c",
    "evals/evidence.schema.json": "bcd329da7fa7b972d574cbb717f67a5ded698a4a1abd6f1496911cc04133d5e3",
    "evals/fixtures/portable/destination/SKILL.md": "f9c929003cb7ea451b8d99f33ba8da6aae7a0d1f830e820b3236a6fa53f73071",
    "evals/fixtures/portable/destination/schema.json": "cc41865b232a01ab9e91bebc7c6465d065637e32ad0301f03acbc00180c260a6",
    "evals/fixtures/portable/evidence/destination-manifest.json": "4829e16fa497c5b5b7a48ce9b0ec5d0f37f1d2b37d65ce1c775160950e6bb2b2",
    "evals/fixtures/portable/evidence/file-dispositions.json": "d6eff48694bf737732d4dd0915f4673ecf8caaaa4596761312c1a774e372950c",
    "evals/fixtures/portable/evidence/source-manifest.json": "69e6d3c1d21a1e17f76f90dab241ad863edf7f2acf904cbbccd81742abf04158",
    "evals/fixtures/portable/source/SKILL.md": "f7c52819d71a8fb19d71a5476997f68076b1f88b7a483d27db9dea8ccfc3e51e",
    "evals/fixtures/portable/source/schema.json": "cc41865b232a01ab9e91bebc7c6465d065637e32ad0301f03acbc00180c260a6",
    "evals/profiles.json": "dc673745727537ca90761d9b3df6f3c477aea8e6e80c6560e225e010f0196cf0",
    "evals/runtime.json": "ee3f67492dd9e964befc4038ccdd5d03d282b288eb90f142114798c3a394ea46",
    "evals/validator-cases.jsonl": "3c98d4dd41a8f53d6278ed48d67829d4314ec7dd655c34ea6d813c55a436655a",
    "references/adaptive-shared-contracts.md": "88080c9ae97dcd390de78115bcfa01c702d72a8b47294fac443c8106abb07d48",
    "references/adaptive-validation.md": "cf26cfc39ca5a588d05c7cc3f733d62528b1c5e7ea8d0052ee1eb038721c4032",
    "references/assessment-ownership.md": "5dd283d36cf823ce1345a7625778d5049a8f81c54348a4007a96eb6605f8cc88",
    "references/authoring-intake.md": "7431f5e1f657cff14cadc6473fa4cfe42f5bc2a7e8192a47f56538c4fd5175e5",
    "references/evaluation.md": "16f74b8024741ba7a0fe4138503e26de7d412f0e1e7dfe632ac15a8e153105f6",
    "references/evaluator-contracts.md": "ac2043678eaaa2addb2ccd4ba2e086fcae99603ae9c3bbafbe9d1e946b17affa",
    "references/handoff.md": "35913a5afe874f15e64e3c9a5c1c0e8641fadf9ec3626094ea85cf5e39f116ed",
    "references/origin.md": "8300afc32f038b17a79ed2ea6d8f92ac50cdb68536f4044f2feed3cd7b87a649",
    "references/reporting.md": "e44544819a384896c34f5e39c18fed2f23450c115b3c82f29ed8666723cdf7cb",
    "references/rules.md": "44b522c37d657f99db1e3673f6572fb92715e35007e3600d4506642a6599bd8b",
    "references/set-trials.md": "afd81fdee6f4b6b37f04b26d66f705690c5d8ab69affe286b81743fcd132a4e9",
    "references/text-resource-checks.md": "0fa807104b4146921fc7506fd2e4b863e1766b0c431c691884fa67fd1b641495",
    "references/trials.md": "31abea6c0919cece39801e394e61c2750abb2e4df4368ee0ed9fc1729c7c09d0",
    "schemas/adaptation-proposal-v1.schema.json": "c6e46c5cfbe49777a7c7c11787e3a1d871d2e70243971a96d2b118fab4fceef6",
    "schemas/adaptation-selection-v1.schema.json": "f4f8d67c58dd9be279828af74ef96a025e39839c2a8d53f948ba4bf0176f60e1",
    "schemas/adaptive-check-observation-v1.schema.json": "e58827d155c1687fad6ebe92b407ba3c40c49668f74fa42e3107ead01d2f171f",
    "schemas/adaptive-common.schema.json": "494d83f8c0cb4ef1cfd09efd29be825142ed863c3011082f7c2a2fec8780b0e5",
    "schemas/adaptive-observation-v1.schema.json": "ae335505541800dfd5819a5093829b1bc10fb604c528c7d054725656c1c6ce8c",
    "schemas/adaptive-observations-v1.schema.json": "2fd2b05f41e0707a0ce4c0d07ebeb6c4848c7a42bc9bdba787a9aba2b52cc50c",
    "schemas/adaptive-skill-v1.schema.json": "9269b2f9ac2812bc2a826b83726a5ff249086fd7c23521c1fdb5b115b36afae7",
    "schemas/authoring-baseline.schema.json": "d25094200a70d5696ddad8953980ba4659ffd160f882b6f128462857987af746",
    "schemas/authoring-contract.schema.json": "e8e677713d22948d63383573a2e7cf6d2fa484137f2ce130cf2e5c5dc224d099",
    "schemas/authoring-record.schema.json": "95b070fbe92df760781483c7a89becfa45ea5d6c7a0f033a21b82e0b3283ad9d",
    "schemas/binding-observation-v1.schema.json": "d6bbf7eee246a06f811413cdfa1c88ea1265bebff6e14581ef0393858ddc7abb",
    "schemas/project-binding-v1.schema.json": "fb0d98d650d443ee1d613d27e632696a4422d101ce6dd37b1eca6e9189fd3399",
    "schemas/project-evidence-v1.schema.json": "e8d9cbc8a6e76ba9cce5d8422dbc599673e3e489a6c25d750c1820409fc957e9",
    "schemas/set-assessment-v1.schema.json": "2c6d4bb5eb87e0fccf24e6e666ba52b700e8ad5fd8bd974a4228b203201de2c7",
    "schemas/set-authoring-v1.schema.json": "d5b9840fe7daf8ab810315d28c9c3539b3e644eb4293e0a8699364ae77981ae8",
    "schemas/set-validation-request-v1.schema.json": "f4006f5e161a8cef5aaefb9d2e2350c055ed4e5e04e87d0b52c269911555514e",
    "schemas/standalone-set-input-v1.schema.json": "bd32ea5e9b0813a7193832ed9b7aaf1d10892560477777feb7abfd12b41d54c5",
    "schemas/validation-request.schema.json": "8d1c75d557475de6159ee23eea7040f8aa9f8281ed21100a6641f8b91f60b367",
    "scripts/adaptive_contracts.py": "49566784cca13df853f91c87022fb2136293141aad40932e8b960894b7820b8a",
    "scripts/adaptive_observe.py": "332b898be69ce114bddc8859218d4102e2428766498269bec4d51cad29174397",
    "scripts/authoring_intake.py": "0faa38c7a4f9e06a7a8bccb018490a0bca44a713ebc2b2b941f6df1293f3af99",
    "scripts/build_evidence.py": "0fc4b5c83dbf7956b4f287310f8849f3d69fcab8baabd578d47a91a2e98e3fd3",
    "scripts/custody.py": "803f41d1a3bde866f1dbcdf1a201526e56d35ca297e50be48dd0e2ba7af5aa0e",
    "scripts/graders.py": "d21e43c151c4952e8a85743db8e322c0d77744cbd93a2f0c269277cb19f2533c",
    "scripts/observe.py": "ddc7ed1c07ccbadc652dd58749a35be179a234544ad21c9a02ee7a143c761d5f",
    "scripts/run_evaluation.py": "f538b80a4119348bc74d72cffb24b35ade59dfa00b4960f2a7d2e0c4f50a9cb8",
    "scripts/text_resources.py": "4aa375f1a189188bbf672a1cecf95f2c7c8a69457be275ead64f2ed93a2dfd3b",
    "tests/adaptive_fixtures.py": "da278f1bed3e8a147b90acc76025afe2a4f7a0cbb9a590bb3659d896c7cc666e",
    "tests/adoption_fixture.py": "c54aad9413ed52c04f4c03195be13822f5d8864520d8f05017dd6968262a9f60",
    "tests/fixture_data.py": "3f3298a473342c7c9cd288cc06a45a52201aa9a9203030edde5b189b09277291",
    "tests/test_adaptive.py": "49d87a9fcf51fe60e9d66df1994d1d8adc4bc7684dc6e28311b4f56e4d45ecfa",
    "tests/test_adoption.py": "2be635e1b22cd56f89ccfdd3dd193ea720aeeaf80e1654863540d8605e56e093",
    "tests/test_authoring.py": "78a4dd5377e38fe6230564116ce2c88239ec000c118b64ad9cbdee64464a1177",
    "tests/test_enhancements.py": "067b5a69bfc46c613c5e0da5e72be3e80209aa364e22dbe93391d2e6a6a82ff2",
    "tests/test_evaluation.py": "1f0434de0cafb1d968361eb16ab42ba7e06cc6e539103e9450f5302505210ac0",
    "tests/test_observe.py": "b61e8592f82ca70cc4f9ac787db8dd9c2ab2bc6bb5a69cb0c3fc75d70e8ca3ef",
    "tests/test_review_inputs.py": "c98b593f90304bffcb2946a632fcb336a19265d0049c66d7ab2d337228d7c658",
    "tests/test_review_provenance.py": "53f68b79ecc8aa58cb603405d6e781620198191b10925dabbd93b2f50ec3c065"
  }
}
